{
  "$schema": "https://json-schema.org/draft/2020-12/schema",
  "$id": "https://raw.githubusercontent.com/HDPark95/witness-graph/main/schemas/case.schema.json",
  "title": "Benchmark case",
  "description": "One graded incident. Each case is derived from a real production failure, stripped of service names, personal names and internal identifiers, then replanted on synthetic metadata. The answer key is what makes this a benchmark rather than a demo.",
  "type": "object",
  "required": ["case_id", "symptom", "seed", "ground_truth"],
  "additionalProperties": false,
  "properties": {
    "case_id": { "type": "string", "pattern": "^MTI-[0-9]{3}$" },
    "title": { "type": "string" },
    "symptom": {
      "type": "string",
      "description": "Exactly what a human would report. Must NOT hint at the cause. `Signups from channel C fell to zero on the 14th` is fair; `the collector for channel C died` gives the answer away."
    },
    "difficulty": { "enum": ["easy", "medium", "hard"] },
    "seed": {
      "type": "object",
      "description": "Deterministic instructions for planting this failure into the synthetic warehouse and DataHub instance. Re-running the seed must reproduce the case byte-for-byte, otherwise scores are not comparable across runs.",
      "required": ["operations"],
      "additionalProperties": false,
      "properties": {
        "operations": {
          "type": "array",
          "minItems": 1,
          "items": {
            "type": "object",
            "required": ["op"],
            "properties": {
              "op": {
                "enum": [
                  "drop_rows",
                  "shift_timezone",
                  "inject_bot_traffic",
                  "widen_freshness_window",
                  "change_collation",
                  "repoint_detector",
                  "stop_collector",
                  "rename_field"
                ]
              },
              "target": { "type": "string" },
              "params": { "type": "object" }
            }
          }
        }
      }
    },
    "ground_truth": {
      "type": "object",
      "required": ["verdict", "root_cause_key"],
      "additionalProperties": false,
      "properties": {
        "verdict": {
          "enum": ["customer_behavior", "instrument_failure", "definition_change", "upstream_data_defect"]
        },
        "root_cause_key": { "type": "string" },
        "explanation": { "type": "string" }
      }
    },
    "must_cite": {
      "type": "array",
      "items": { "type": "string" },
      "description": "Source refs a correct investigation cannot avoid touching. Drives citation recall. Reaching the right verdict without these is scored as a lucky guess and reported separately."
    },
    "must_not_conclude": {
      "type": "array",
      "items": { "type": "string" },
      "description": "Root cause keys that look plausible but are wrong here. Concluding one of these counts as a confident-wrong answer, which is scored worse than `inconclusive`."
    },
    "distractors": {
      "type": "array",
      "items": { "type": "string" },
      "description": "Real but irrelevant anomalies planted alongside the true cause, so that a correct verdict requires discrimination rather than pattern matching."
    },
    "provenance": {
      "type": "object",
      "additionalProperties": false,
      "description": "Internal only. Never published in the public repository.",
      "properties": {
        "derived_from": { "type": "string" },
        "anonymized": { "const": true }
      }
    }
  }
}
